<?xml version="1.0" encoding="UTF-8"?>
<!DOCTYPE school SYSTEM "myxml.dtd">

<school id="duyi" name="渡一教育" loc="哈尔滨">
    <class id="one" name="Java1期" loc="上海">
        <teacher id="t1" name="zzt" age="18">
            <sex>男</sex>
        </teacher>
        <student id="s1" name="赵一" age="15">
            <sex>女</sex>
        </student>
        <student id="s2" name="钱二" age="16">
            <sex>女</sex>
        </student>
        <student id="s3" name="孙三" age="17">
            <sex>男</sex>
        </student>
        <student id="s4" name="李四" age="18">
            <sex>男</sex>
        </student>
    </class>
    <class id="two" name="Java2期" loc="深圳">
        <teacher id="t2" name="panda" age="58">
            <sex>纯爷们儿</sex>
        </teacher>
        <student id="s5" name="周五" age="18">
            <sex>男</sex>
        </student>
        <student id="s6" name="吴六" age="17">
            <sex>男</sex>
        </student>
        <student id="s7" name="郑七" age="16">
            <sex>女</sex>
        </student>
        <student id="s8" name="王ba" age="15">
            <sex>女</sex>
        </student>
    </class>
</school>